milestone_id,period_id,tradition_id,mode_id,contribution,representation_form,long_term_significance,responsible_interpretation_note
ms_mesopotamian_tables,period_antiquity,trad_mesopotamian,mode_procedural,"sexagesimal place-value computation, reciprocal tables, worked problem forms",clay tablets and numerical tables,reliable calculation through trained procedural systems,modern algebraic reconstruction should not be confused with original notation
ms_egyptian_measurement,period_antiquity,trad_egyptian,mode_procedural,"fraction methods, area and volume rules, administrative arithmetic",papyrus problem texts,"mathematics as measurement, distribution, and practical record",surviving texts are partial and practical rather than a full theory archive
ms_greek_deduction,period_classical,trad_greek,mode_deductive,axiomatic geometry and proposition-proof architecture,"definitions, postulates, diagrams, proofs",proof becomes a central mathematical ideal,deductive proof should not be treated as the only form of mathematical thinking
ms_archimedean_exhaustion,period_classical,trad_greek,mode_analytic,"method of exhaustion, geometric bounds, areas and volumes",geometric diagrams and bounding arguments,early rigorous limiting reasoning,do not collapse ancient exhaustion into modern epsilon-delta analysis
ms_indian_place_value,period_classical_medieval,trad_indian,mode_algebraic,"zero, decimal place value, algorithmic arithmetic, astronomy, trigonometry","numerals, rules, tables, verse, commentary",scalable arithmetic and algorithmic calculation,recognize both computational power and distinct genres of justification
ms_chinese_systems,period_classical_medieval,trad_chinese,mode_procedural,"linear systems, rod calculation, dissection, configurational reasoning","counting rods, tables, diagrams, commentary",systemic and algorithmic mathematical reasoning,procedural verification should not be dismissed as mere calculation
ms_islamic_algebra,period_medieval,trad_islamic,mode_algebraic,"algebra, trigonometry, equation classification, translation, astronomy","manuscripts, equation types, tables, geometric justification",global synthesis and transformation of algebraic and geometric reasoning,transmission was an active intellectual achievement
ms_renaissance_symbol,period_renaissance,trad_european_modern,mode_algebraic,"symbolic notation, cossic algebra, perspective, technical mathematics","printed books, symbols, diagrams",portable symbolic methods and technical applications,print standardizes but also filters mathematical authority
ms_calculus_coordinates,period_early_modern,trad_european_modern,mode_analytic,"analytic geometry, calculus, mechanics, probability","coordinates, equations, functions, differentials, integrals",mathematics becomes a language of natural science and change,mathematical models require interpretation and assumptions
ms_nineteenth_rigor,period_nineteenth,trad_european_modern,mode_analytic,"epsilon-delta rigor, real numbers, functions, convergence, infinity","quantifiers, inequalities, sets, functions",definitions and rigor reshape mathematical standards,"rigor is historically developed, not timelessly fixed"
ms_non_euclidean,period_nineteenth,trad_european_modern,mode_structural,non-Euclidean geometry and alternative axiom systems,"axioms, models, geometric systems",axioms become structural assumptions,mathematical truth becomes conditional on systems
ms_foundations_logic,period_twentieth,trad_international_modern,mode_formal_verified,"set theory, symbolic logic, formal systems, incompleteness, computability","formal languages, axioms, proof systems, algorithms",mathematics studies proof and computation themselves,"truth, proof, consistency, and computability must be distinguished"
ms_structural_modern,period_twentieth,trad_international_modern,mode_structural,"groups, rings, fields, topology, functional analysis, categories, graphs","structures, morphisms, spaces, operations, diagrams",mathematics becomes the study of structure,abstraction should remain connected to examples and access
ms_computer_age,period_twentieth,trad_international_modern,mode_computational,"algorithms, complexity, simulation, numerical methods, computer algebra","programs, data structures, algorithms, matrices, graphs",mathematics becomes computational and executable,computation is evidence and exploration but not automatically proof or wisdom
ms_proof_assistants,period_contemporary,trad_international_modern,mode_formal_verified,"proof assistants, formal verification, machine-checked libraries","proof scripts, formal libraries, certificates",proof becomes a computational artifact,"formal verification depends on human definitions, specifications, and interpretation"
