warning_id,concept_id,concept_name,warning,mitigation,responsible_interpretation_note
warn_spec,concept_algorithm,Algorithm,An algorithm can be correct relative to a harmful or incomplete specification.,"Audit objectives, constraints, and consequences.","formal correctness, representation quality, and downstream consequences must be audited separately"
warn_graph_edge,concept_graph,Graph,"Graph edges can imply unsupported association, causation, suspicion, or influence.","Track edge meaning, evidence, provenance, and uncertainty.","formal correctness, representation quality, and downstream consequences must be audited separately"
warn_type_boundary,concept_type,Type,Types and categories can simplify or erase boundary cases.,Document category boundaries and failure cases.,"formal correctness, representation quality, and downstream consequences must be audited separately"
warn_complexity,concept_complexity,Complexity,Small examples can hide explosive growth and exclusion at scale.,Audit complexity and scalability assumptions.,"formal correctness, representation quality, and downstream consequences must be audited separately"
warn_probability,concept_probability,Probability,Probabilistic outputs can be misread as truth or certainty.,"Document calibration, uncertainty, and validation limits.","formal correctness, representation quality, and downstream consequences must be audited separately"
warn_embedding,concept_linear_algebra,Linear algebra,Vector similarity can be mistaken for semantic or moral similarity.,"Validate representation, metric, and downstream use.","formal correctness, representation quality, and downstream consequences must be audited separately"
warn_crypto,concept_modular,Modular arithmetic,Correct modular arithmetic does not guarantee secure implementation.,Use expert cryptographic review and established protocols.,"formal correctness, representation quality, and downstream consequences must be audited separately"
