connection_id,source_idea,target_idea,connection_type,preserved_structure,example,caution_note
conn_proportion_slope,proportion,slope,historical and conceptual generalization,ratio relation,slope as rise over run,slope includes direction and coordinate interpretation beyond simple proportion
conn_geometry_algebra,curve,equation,representation translation,point relation,circle as equation,not every geometric intuition transfers cleanly into algebraic form
conn_derivative_optimization,derivative,optimization,method migration,local change information,critical points,zero derivative is not sufficient for global optimality
conn_group_symmetry,group,symmetry,structural identification,operation and inverse structure,rotations of a polygon,the meaning of symmetry depends on what transformations are allowed
conn_graph_network,graph,network model,model interpretation,node-edge relation,"roads, citations, dependency graphs",edges mean different things in different domains
conn_integral_probability,integral,expectation,analytic unification,accumulation under measure,expected value as integral,probability interpretation and measure assumptions matter
conn_logic_computation,formal logic,programming language theory,formal correspondence,"syntax, rules, derivability",types and propositions,program behavior and proof meaning require interpretation
conn_proof_verification,proof,formal verification,medium transformation,derivation under rules,proof assistant checking a theorem,verified formal statement may not match intended informal claim
