canon_risk_id,risk,problem,responsible_response
canon_eurocentric_sequence,Eurocentric sequence,A Greek-to-European storyline is treated as the whole history of mathematics.,Teach global mathematical traditions and transmission networks.
canon_elite_texts,Elite textual survival,Elite written texts are treated as the whole record.,"Attend to practical, oral, material, craft, and institutional mathematics."
canon_named_individuals,Named-individual overfocus,"Teachers, translators, commentators, and communities disappear.",Document collective intellectual labor and institutional conditions.
canon_gender_exclusion,Gender exclusion,Women's mathematical labor and barriers are minimized.,"Recover excluded labor, institutional constraints, and access barriers."
canon_modern_notation,Modern notation dominance,Modern symbolic reconstruction replaces historical practice.,Present original media and modern reconstructions as distinct layers.
