check_id,question,risk_topic,recommended_action
check_01,Does the narrative avoid this risk: Mathematical history can be reduced to a Greek-European sequence.,canon formation,"Include Mesopotamian, Egyptian, Indian, Chinese, Islamic, African, Indigenous, and other traditions where relevant and well-sourced."
check_02,"Does the narrative avoid this risk: Older mathematics can be judged only by modern notation, proof, or rigor standards.",historical judgment,"Interpret mathematical practices within their own media, genres, institutions, and purposes."
check_03,Does the narrative avoid this risk: Surviving written texts can be mistaken for the whole history of mathematical thinking.,source survival,"Attend to oral, material, craft, architectural, navigational, commercial, and pedagogical practices."
check_04,"Does the narrative avoid this risk: Famous individuals and elite texts can obscure collective labor, commentary, teaching, translation, and institutions.",credit and authority,"Document transmission, commentary, pedagogy, tools, and communities of practice."
check_05,"Does the narrative avoid this risk: Non-European mathematics can be appropriated, minimized, or forced into European categories.",power and classification,Preserve historical specificity and avoid treating European forms as the only standard of mathematical maturity.
check_06,"Does the narrative avoid this risk: Formalization, computation, and proof assistants can be treated as the inevitable final form of mathematics.",modern computation,"Recognize computation as a powerful medium that remains dependent on human choice, meaning, and responsibility."
