tradition_id,name,region_or_language_context,primary_media,dominant_thinking_mode,historiographic_caution,inclusion_reason
trad_mesopotamian,Mesopotamian scribal mathematics,Akkadian/Sumerian cuneiform and scribal schools,"clay tablets, tables, worked examples",procedural computation and tabular calculation,do not judge procedural mathematics only by later proof standards,included to resist a narrow linear canon and foreground multiple forms of mathematical thinking
trad_egyptian,Egyptian mathematical papyri,hieratic papyrus and administrative contexts,"papyrus, measurement rules, worked problems","measurement, fractions, administrative arithmetic",surviving papyri are partial evidence of broader practice,included to resist a narrow linear canon and foreground multiple forms of mathematical thinking
trad_greek,Greek deductive mathematics,Greek-language mathematical and philosophical cultures,"diagrams, propositions, manuscripts",deductive proof and geometric demonstration,Greek proof is central but not the only historical form of mathematical reasoning,included to resist a narrow linear canon and foreground multiple forms of mathematical thinking
trad_indian,Indian mathematical astronomy and arithmetic,Sanskrit and related scholarly traditions,"verse, rules, commentary, tables","algorithmic arithmetic, astronomy, algebra, trigonometry",avoid forcing all justification into Euclidean proof categories,included to resist a narrow linear canon and foreground multiple forms of mathematical thinking
trad_chinese,Chinese procedural and configurational mathematics,"Chinese textual, rod-calculation, and commentarial contexts","counting rods, tables, diagrams, commentaries","procedure, configuration, systems, dissection",procedural verification and commentary deserve serious mathematical interpretation,included to resist a narrow linear canon and foreground multiple forms of mathematical thinking
trad_islamic,"Islamic algebraic, geometric, and astronomical synthesis","Arabic, Persian, and multilingual scholarly worlds","manuscripts, tables, commentaries, instruments","algebra, trigonometry, translation, astronomy","transmission was also creative transformation, not passive preservation",included to resist a narrow linear canon and foreground multiple forms of mathematical thinking
trad_european_modern,Early modern and modern European mathematics,"Latin and vernacular print cultures, academies, universities","printed books, journals, symbolic notation","symbolic algebra, calculus, rigor, structural abstraction",avoid presenting modern European mathematics as the whole history of mathematics,included to resist a narrow linear canon and foreground multiple forms of mathematical thinking
trad_international_modern,International modern mathematics,"global research communities, journals, conferences, software","papers, code, proof libraries, data repositories","structure, computation, formalization, modeling",formalization and computation remain shaped by human institutions and values,included to resist a narrow linear canon and foreground multiple forms of mathematical thinking
