warning_id,topic,warning,mitigation,responsible_interpretation_note
warn_presentism,history,Modern notation can make earlier mathematics appear less sophisticated than it was.,Separate reconstructed algebraic structure from original notation and reasoning.,"notation should be taught with meaning, historical context, assumptions, and access in view"
warn_eurocentrism,canon,Notation history can be reduced to European symbolic algebra.,"Include Indian, Chinese, Islamic, Mesopotamian, Egyptian, Greek, and other traditions.","notation should be taught with meaning, historical context, assumptions, and access in view"
warn_symbol_opacity,pedagogy,Compact notation can make meaning opaque for learners.,"Teach notation as meaningful structure, not decoration.","notation should be taught with meaning, historical context, assumptions, and access in view"
warn_domain_assumption,mathematical validity,Symbolic transformations can hide domain restrictions and nonzero assumptions.,"State domains, operations, and valid transformation conditions.","notation should be taught with meaning, historical context, assumptions, and access in view"
warn_programming_confusion,computing,Mathematical equality and programming assignment are easily confused.,"Distinguish equality, identity, definition, assignment, and comparison operators.","notation should be taught with meaning, historical context, assumptions, and access in view"
warn_computer_algebra,computer algebra,Symbolic simplification can be treated as interpretation or proof without assumption checks.,"Audit assumptions, domains, branch cuts, and expression equivalence conditions.","notation should be taught with meaning, historical context, assumptions, and access in view"
